{
  "schemaVersion": "1.0",
  "id": "PA-WDL-001",
  "title": "Parsed workflow expressions",
  "domain": "power-automate",
  "severity": "error",
  "description": "Flow contains a malformed or path-invalid workflow expression.",
  "rationale": "The inspected final artifact must preserve the declared offline safety contract.",
  "appliesTo": [
    {
      "kind": "definition"
    },
    {
      "kind": "zip",
      "profile": "power-platform-solution-v1"
    }
  ],
  "detector": {
    "implementation": "packages/rules/src/power-automate/wdl.ts",
    "exportName": "paWdl001",
    "input": "artifact-graph",
    "deterministic": true,
    "network": "forbidden",
    "parameters": {}
  },
  "red": {
    "root": "fixtures/rules/PA-WDL-001/red",
    "expectedResult": "FAIL",
    "expectedDiagnosticCodes": [
      "PA-WDL-001"
    ]
  },
  "green": {
    "root": "fixtures/rules/PA-WDL-001/green",
    "expectedResult": "PASS",
    "expectedDiagnosticCodes": []
  },
  "finalArtifact": {
    "required": true,
    "artifactKinds": [
      "generated-definition",
      "zip"
    ]
  },
  "remediation": [
    "Correct delimiter and argument structure, then reference only normalized actions that exist on the guaranteed execution path."
  ],
  "residualGate": {
    "required": true,
    "claimClass": "LIVE_SMOKE",
    "description": "Runtime expression evaluation remains external."
  },
  "supportedEvidence": [
    "LOCAL_STATIC",
    "PACKAGE_ARTIFACT"
  ],
  "tags": [
    "power-automate",
    "offline",
    "synthetic"
  ]
}
